bibtex	year	author	title	url	venue	ML-Formal	ML-Instrumental	ML-Personal	Domain-Formal	Domain-Instrumental	Domain-Personal	Milieu-Formal	Milieu-Instrumental	Milieu-Personal	codes
hohman_visual_2019	2019	"Hohman, Fred; Kahng, Minsuk; Pienta, Robert; Chau, Duen Horng"	Visual Analytics in Deep Learning: An Interrogative Survey for the Next Frontiers	https://arxiv.org/pdf/1801.06889.pdf	IEEE Transactions on Visualization and Computer Graphics	Model-developers and builders	"These are users who may have some technical background but are neural network novices   "". Common tasks include using well-known neural network architectures for developing domain specific applications, training smaller-scale models, and downloading pre-trained model weights online to use as a starting point. This group of users also include machine learning artists who use models to enable and showcase new forms of artistic expression."	well-developed intuition...mastery over models... vary hyperparameters					"These are individuals who typically have no prior knowledge about deep learning, and may or may not have a technical background. Much of the research targeted at this group is for educational purposes, trying to explain what a neural network is and how it works at a high-level, sometimes without revealing deep learning is present. These group also includes people who simply use AI-powered devices and consumer applications.  ""These group also includes people who simply use AI-powered devices and consumer applications."""		O4: explain decisions made by medical imaging models; O1: debugging
ferreira2020people	2020	"Ferreira, Juliana J.; Monteiro, Mateus S."	What Are People Doing About XAI User Experience? A Survey on AI Explainability Research and Practice	https://link.springer.com/chapter/10.1007/978-3-030-49760-6_4	"Design, User Experience, and Usability. Design for Contemporary Interactive Environments"	"ML experts, which are people capable of building, training and testing machine learning models with different datasets from different domains."	Non-ML-experts ...[who] use ML tools to perform tasks..							"non-experts in context-agnostic contexts, discussing privacy and personal data"	"O1: ""using explanations to improve an aspect, a part of the system, among others""; G2; O2: GDPR"
tonekaboni_what_2019	2019	"Tonekaboni, Sana; Joshi, Shalmali; McCradden, Melissa D.; Goldenberg, Anna"	What Clinicians Want: Contextualizing Explainable Machine Learning for Clinical End Use	http://proceedings.mlr.press/v106/tonekaboni19a.html	Machine Learning for Healthcare Conference		"Clinicians repeatedly identified that knowing the subset of features deriving the model outcome, is crucial"		"clinicians from two distinct acute care specialties (Intenstive Care Unit and Emergency Department), Provide a level of transparency that allows users to validate model outputs with domain knowledge."""	clinicians	critical factor for continued usage was whether the tool was repeatedly successful in prognosticating their patient’s condition in their personal experience.		"[Interview] settings were chosen because both departments are areas where we foresee implementation of ML tools to support clinical care. Additionally, both departments have current experience working with either early warning/alert systems or opaque, non-ML decision support tools"	"Many clinicians noted that “alarm or click fatigue” (indicating the annoyance with repeating response prompts through the EHR system) (Embi and Leonard, 2012) is a significant concern that may be worsened by prediction tools. This issue is ubiqitous across healthcare contexts and requires careful consideration"	"O4: ""viewed explainability as a means of justifying their clinical decision-making (for instance, to patients and colleagues)""; G2: ""Building trust between clinicians and ML models""; O3: ""facilitate trust in the model as well as directing use in specific patient populations and determining parameters guiding appropriate use""; T5: ""clarity around why the model under-performs"""
brennen_what_2020	2020	"Brennen, Andrea"	"What Do People Really Want When They Say They Want ""Explainable AI?"" We Asked 60 Stakeholders."	https://doi.org/10.1145/3334480.3383047	Extended Abstracts of the 2020 CHI Conference on Human Factors in Computing Systems		" ""data scientist""; ""end users of ML and AI systems"""				a lay person affected by an automated decision likely has his or her own intuitive notion of what outcomes seem fair or just. It is easy to imagine an affected individual dismissing an outcome		"When we shared the findings from this technology study with others in government and industry, we saw that today’s XAI tools do not fully capture the types of explanations that many people want."		"G2; G1: ""they wanted better tools to determine if their code was executing properly, to confirm that code was doing what they thought it was doing, and to help them build intuition about how models worked.""; O2: ""Explainable AI as an important means of auditing models"""
ribera2019can	2019	Riberiera & Lapedriza	Can we do better explanations? A proposal of User-Centered Explainable AI	http://ceur-ws.org/Vol-2327/IUI19WS-ExSS2019-12.pdf	Joint Proceedings of the ACM IUI 2019 Workshops	"Developers and AI researchers: investigators in AI, software developers, or data analysts who create the AI system.  KN: * Lay users: ""with no technical background, would not be interested at all about these type of explanation"""			Domain experts: specialists in the area of expertise where the decisions made by the system belong to. For example: physicists or lawyers.		"Lay users: the final recipients of the decisions. For example: a person accepted or rejected on a loan demand, or a patient that has been diagnosed  KN: Not sure if they mention any knowledge status of lay users, although it would be strange to include AI researchers and domain experts, and not lay users just because no explanation was provided for the lay users.  HS: yeah, I generally put users described as ""decision subjects"" under milieu-personal in the few I coded.  "				O1: improvement; T2: verification to detect bias; O6: learn from the system; O3: right to an explanation that has consequences; O2: compliance with legislation
cheng2019explaining	2019	Cheng et al	Explaining Decision-Making Algorithms through UI: Strategies to Help Non-Expert Stakeholders	https://dl-acm-org.libproxy.mit.edu/doi/abs/10.1145/3290605.3300789	Proceedings of CHI Conference on Human Factors in Computing Systems (CHI '19)					"According to Model 6, higher technical literacy was associated with higher levels of self-reported understanding (Coef. = 0.59, p<0.001)."					G2; G1: help users and other stakeholders understand the “algorithmic decision model”; T3: see what attributes cause the algorithm’s action; T4: the user can predict how changes in the situation can lead to alternative algorithm predictions
kizilcec2016much	2016	Kizilcec	How Much Information? Effects of Transparency on Trust in an Algorithmic Interface	https://dl-acm-org.libproxy.mit.edu/doi/pdf/10.1145/2858036.2858402						participants of a MOOC course doing peer grading					"G2: Trust is a key concern in the design of technology, as it affects the initial adoption and continued use of technologies"
paudyal2019learn2sign	2019	"Paudyal, P., Lee, J., Kamzin, A., Soudki, M., Banerjee, A., Gupta, S.K."	Learn2sign: explainable AI for sign language learning	https://explainablesystems.comp.nus.edu.sg/2019/wp-content/uploads/2019/02/IUI19WS-ExSS2019-13.pdf	Joint Proceedings of the ACM IUI 2019 Workshop					learners of sign language					O6: learn about sign language and how to do it correctly; O3: understand how to correct actions based on model feedback
sundararajan2019exploring	2019	"Sundararajan, M., Xu, J., Taly, A., Sayres, R., Najmi, A."	Exploring Principled Visualizations for Deep Network Attributions	http://ceur-ws.org/Vol-2327/IUI19WS-ExSS2019-16.pdf		model developers			doctors						"O1: guide model or training data improvements; O3: assist a human decision-maker, such as a doctor"
nunes2017systematic	2017	Nunnes & Jannach	A Systematic Review and Taxonomy of Explanations in Decision Support and Recommender Systems	https://www.researchgate.net/publication/342229818_A_systematic_review_and_taxonomy_of_explanations_in_decision_support_and_recommender_systems											"G1: explain how the system works; O3: help make decisions better and faster, persuade users to try or buy; O1: debugging; G2; T2: detect mistakes"
xie2019outlining	2019	"Xie, Y., Gao, G., Chen, X.:"	Outlining the Design Space of Explainable Intelligent Systems for Medical Diagnosis	https://arxiv.org/abs/1902.06019					doctors						"O3: ""diagnosis and treatment purposes in their daily work practice"""
zhaO3019transparency	2019	"Zhao, R., Benbasat, I., Cavusoglu, H.:"	Transparency in Advice-Giving Systems: A Framework and a Research Model for Transparency Provision	http://ceur-ws.org/Vol-2327/IUI19WS-IUIATEC-2.pdf										recommendation system users	"O4: ""what they do (e.g. how AGSs generate advice)""; O5: why certain data is collected; T3: ""What/how data is collected"""
krebs2019tell	2019	"Krebs, L.M., et al"	Tell Me What You Know: GDPR Implications on Designing Transparency and Accountability for News Recommender Systems1	https://www.semanticscholar.org/paper/Tell-Me-What-You-Know%3A-GDPR-Implications-on-and-for-Krebs-Rodriguez/81f030002cc3eb57e74570a4e20b01a26ebb6ef1										news recommender users	O2: compliance w/ GDPR
cai2019effects	2019	"Cai, C.J., Jongejan, J., Holbrook, J."	The effects of example-based explanations in a machine learning interface. In: Proceedings of the 24th International Conference on Intelligent User Interfaces	https://dl-acm-org.libproxy.mit.edu/doi/10.1145/3301275.3302289											"O4: give users insight into why the system recognized or did not recognize their drawing; T4: understanding what about the drawing changes the prediction; G1; G2: ""the questions assessed system understanding [...] as well as capability and benevolence, key dimensions of trust"""
bhatia2019explainable	2019	"Bhatia, A., Garg, V., Haves, P., Pudi, V.:"	Explainable clustering using hyper-rectangles for building energy simulation data	https://www.researchgate.net/publication/331500351_Explainable_Clustering_Using_Hyper-Rectangles_for_Building_Energy_Simulation_Data					energy data operators						O6: learn design strategies based on cluster commonalities 
theodorou2017designing	2017	"A Theodorou, RH Wortham, JJ Bryson"	Designing and implementing transparency for real time inspection of autonomous robots	https://www-tandfonline-com.libproxy.mit.edu/doi/abs/10.1080/09540091.2017.1310182?journalCode=ccos20			autonomous robot developers		autonomous robot developers						O1: development and debugging of agents
wexler2020what	2020	Wexler et al.	The What-If Tool: Interactive Probing of Machine Learning Models	https://arxiv-org.libproxy.mit.edu/pdf/1907.04135.pdf		"those with some existing ML experience such as CS students, data scientists, product managers, and ML practitioners."	practitioners					A group of MIT students working on a project for the Foundations of Information Policy course made extensive use of WIT			"O1: debugging; G1: ""medium for model understanding""; T4: explore counterfactuals and how changes to data points affect predictions"
kim2018interpretability	2018	Kim et al.	Interpretability Beyond Feature Attribution: Quantitative Testing with Concept Activation Vectors (TCAV)	https://arxiv.org/abs/1711.11279		model analyst			medical expert						"O1: designing, developing, and debugging models; G2: ensure that ML models reflect our values"
samek2017explainable	2017	Samek et al. 	"Explainable Artificial Intelligence: Understanding, Visualizing, and Interpreting Deep Learning Models"	https://www.itu.int/dms_pub/itu-s/opb/journal/S-JOURNAL-ICTF.VOL1-2018-1-P05-PDF-E.pdf											T2: verification of the system for bias/mistakes; O1: debugging/imporvement; O6: learning game strategy (Go); O2: compliance with legislation
ustun2019recourse	2019	Ustun et al.	Actionable Recourse in Linear Classification	https://arxiv-org.libproxy.mit.edu/pdf/1809.06514.pdf										affected decision subjects / loan applicants	O3: understand how to get the desired outcome; O7: contest the decision if the desired outcome is discriminatory; T4: understand the influence of different factors to see what will change the outcome